sentiment,article
2,"( ADP News ) - Sep 30 , 2008 - Finnish security and privacy software solutions developer Stonesoft Oyj said today that it won a USD 1.9 million ( EUR 1.3 m ) order to deliver its StoneGate network security products to an unnamed Russian te"
0,"The OMX Helsinki index was down 0.34 pct at 8,256.02 on turnover of 813.191 mln eur ."
1,These restrictions do not apply to statutory dividends .
0,Finnlines estimated in its annual general meeting that 2008 will be financially a tough year due to large investments .
1,"With this , the company will exit the contract manufacturing service segment ."
2,Orders received grew by 55 % year-on-year to EUR732m .
1,"The company 's plant in Russia will continue to make tyres for its near markets , while the plant in Nokia in Finland will manufacture tyres for other markets ."
1,"The contract covers installation , training and start-up services ."
1,`` This could be us .
1,"Information system supplier Sentera -- up 24.51 pct -- was the next most heavily traded share after SysOpen Digia , a software house , acquired 77.4 pct of the company this morning for just under 33 mln eur ."
1,Finnish Stockmann Group 's mail order unit Hobby Hall has launched a trial marketing campaign in Russia .
2,"Turun kaupunkin , Finland based company has awarded contract to Lemminkainen Talotekniikka Oy for electrical installation work ."
1,"In the first quarter of 2008 , Sacanfil 's net sales totalled EUR 50.0 mn and its operating profit EUR 4.7 mn ."
2,"OUTOTEC OYJ PRESS RELEASE , FEBRUARY 19 , 2008 AT 11.00 AM Outotec has won two large minerals processing technology orders from Mirabela Mineracao do Brasil Ltda , Brazil and from Cumerio Med JSCo , Bulgaria ."
1,The new location is n't the only change Wellmont has in store for its air transport service .
2,"Both operating profit and net sales for the six-month period increased , respectively from EUR7 .5 m and EUR655 .5 m , as compared to the corresponding period in 2005 ."
1,hu will offer a further discount of between 25 % and 50 % on selected books .
2,Operating profit improved by 44.0 % to ER 4.7 mn from EUR 3.3 mn in 2004 .
1,Martela is a front runner in providing innovative solutions and customer service Martela designs and supplies interior solutions for working environments and public spaces .
1,"In addition , the contract includes modification of the effluent treatment plant at Follum ."
1,`` Small well targeted acquisitions have played an important role in executing Satama 's strategy in the past couple of years .
1,Pohjola will act as the manager of the issue and the bond will be listed on NASDAQ OMX Helsinki Ltd. .
2,"A purchase agreement for 7,200 tons of gasoline with delivery at the Hamina terminal , Finland , was signed with Neste Oil OYj at the average Platts index for this September plus eight US dollars per month ."
1,The company 's net sales in 2010 totalled MEUR 311.4 with an operating margin of 13.9 per cent .
1,The serial bond is part of the plan to refinance the short-term credit facility .
1,"The second variant offers complete final finishing of any selected apartment with foreign high quality materials ( Finland , Denmark , Germany , France ) ."
1,"ALEXANDRIA , Va. , Jan. 9 -- United States Patent no. 7,862,685 , issued on Jan. 4 , was assigned to Kemira Chemicals Inc. ( Marietta , Ga. ) ."
1,SSH Establishes New Global Sales and Marketing Group to be led by George Adams ; Adams Establishes Global Sales and Marketing Group to Drive Worldwide Programs Supporting SSH Tectia Enterprise Security Solutions
1,"In Finland , the launch of tie-in sales of 3G mobile phones did not cause a dramatic rush in mobile retail outlets during the first few days ."
1,"Kesko offers Hilton to open a hotel on Kalinisky prospect in a 18,000-square metres building because of these difficulties ."
1,"Based on the 2005 calendar year the combined company had EUR15 .8 bn in pro forma annual revenues and is expected to start operations with 60,000 employees ."
1,"The engine has an electrical output of 18,321 kW , making it the largest gas powered generating set in the world ."
0,"Operating profit totaled EUR 9.4 mn , down from EUR 11.7 mn in 2004 ."
1,"The firm 's services include copying , printing , CAD-modelling , digital printing , scanning , SokoPro project bank and courier services ."
1,Eriikka S+¦derstr+¦m has previously held several positions in finance and control at Nokia Networks including acting as the Business Group Controller and having the corporate controller position at Nokia Siemens Networks .
0,Kone said in court papers that the union action delayed repairs to elevators at the federal courthouse on Jan. 21 and the Saltonstall state office building on Jan. 23 .
1,"About 36 % of this came from Aspo Chemicals , 39 % from Aspo Shipping and 25 % from Aspo Systems ."
2,"Vaisala Oyj Press Release September 30 , 2010 Vaisala has signed a contract to sell its oxygen measurement technology and business to SICK Maihak GmbH ."
2,Finnish plumbing and heating systems supplier Uponor Corporation ( OMX Helsinki : UNR1V ) said on Tuesday ( 12 August ) that its board of directors has authorised the management to proceed with a company-wide cost reduction program .
1,Pentik+Æinen emphasises that the most of the internet contents media houses provide can not be free forever .
2,Operating profit rose to EUR2 .4 m from EUR1 .6 m year earlier .
1,The issuer is solely responsible for the content of this announcement .
0,"Finnish software and hardware developer Elektrobit Oyj HEL : EBG1V , or EB , said today it will temporarily lay off up to 200 people for a maximum of 90 day in Finland , aiming to achieve cost savings of EUR 1.7 million USD 2m in the second half of 2010 ."
2,"Salo , Finland , 29 August 2006 - Benefon has today announced its plans to further strengthen its in-house technology platform , by licensing the complete mobile software platform , Opna , from its long-standing technology partner , Pollex ."
0,"Biohit said that it will reduce the number of leased personnel by 10 , and lay off 10 of its own personnel ."
1,"Latin America currently accounts for approximately 40 % of sales at Tecnotree , company president and CEO Eero Mertano recently told BNamericas ."
1,The most significant challengers in the market are Logset and Sampo-Rosenlew .
2,"Kalnapilio-Tauro Grupe ( Kalnapilis-Tauras Group ) , which is owned by Denmark 's Royal Unibrew , raised its market share to 25.2 percent from 23.91 percent , as beer sales for the nine months jumped by 11.4 percent to 52.99 million liters ."
2,"The agreement was signed with Biohit Healthcare Ltd , the UK-based subsidiary of Biohit Oyj , a Finnish public company which develops , manufactures and markets liquid handling products and diagnostic test systems ."
2,"The Finnish government announced Wednesday that it sold a 32 percent stake in chemicals and fertilizer group Kemira Oyj for (  x20ac ) 655.6 million ( $ 890US million ) , sending the company 's share price up 6 percent ."
1,A spokeswoman for the Italian fashion house declined comment on the settlement .
2,Olvi has posted a strong set of figures for the first six months of this year .
1,"The outsourced Scan and Capture solutions transfer paper invoices into electronic format , and Basware Business Transactions Service allows the customer to receive and send invoices in an electronic format ."
2,"The Australian company Mirabela Nickel has awarded Outokumpu Technology a contract for grinding technology for its nickel sulfide project in Bahia State , Brazil ."
1,Marimekko is considering further measures in the matter .
1,Currency conversions are based on exchange rates at the time of the deal .
1,"The company said that 80 % of the shares of the holding company will be sold to Meadville Holdings Limited , a Hong Kong listed parent company of the Meadville Group ."
2,"The broker highlights Cargotec as its preferred stock in the sector , as it is a pure play on global cargo and container handling , and it expects it to play an active role in further consolidating the industry ."
2,"Furthermore , our fully electrically driven cranes are environmentally friendly ."
1,"Aspo 's strong company brands - ESL Shipping , Leipurin , Telko and Kaukomarkkinat - aim to be the market leaders in their sectors ."
1,"The Costanza light , with an aluminum base and washable shade , comes in white , pistachio , orange , blue and red ."
1,"The employer-employee talks concerned about 500 people , that is , the whole staff in Finland ."
2,Production will expand to other of Elcoteq 's locations including Mexico and Hungary during 2010 .
1,"Following the payment made in April , the company has a total of EUR 23.0 million in loans from financial institutions ."
2,EuroChem Head of Corporate Finance Alexander Gavrilov said : `` I am pleased that we have once again confirmed that EuroChem is able to attract long-term funds at attractive rates .
0,"Salcomp Oyj , the Finnish maker of mobile phone chargers , Monday posted a EUR1 .49 million loss in the second quarter compared with a 1.70 million profit in the same period the previous year ."
1,"M-real Corporation Stock Exchange Announcement 29 September 2006 at 4.15 p.m. Kyro Corporation and M-real Corporation , a Metsaliitto Group subsidiary , have agreed on an arrangement which gives M-real option to purchase the Kyroskoski natural gas powerplant from Kyro ."
1,Microsoft last week also issued the first patch for the Windows 7 operating system beta it had released days earlier .
0,Revenue in the quarter fell 8 percent to ( EURO ) 2.4 billion compared to a year earlier .
1,Activities range from the development of natural resources to the retailed marketing of finished products .
1,`` Ruukki is now included on DJSI World for the second year running and the European DJSI STOXX for the third year running .
0,"Operating loss totalled EUR 3.2 mn , compared to a profit of EUR 7.2 mn in the third quarter of 2008 ."
2,Passenger-related revenue rose by 5.1 % to EUR 460.8 mn from EUR 438.5 mn in 2009 .
1,"Other measures included increasing synergies and economies of scale within the Grimaldi Group and personnel adjustments , divestments and redelivery of excess tonnage ."
1,"First Industrial will seek LEED designation for Uponor 's new building and a 282,000 square-foot speculative distribution center at First Park Lakeville ."
2,"ADP News - Nov 6 , 2008 - Finnish retail software developer Aldata Solution Oyj OMX : ALD1V said today that it swung to a net profit of EUR 2.1 million USD 2.7 m for the first nine months of 2008 versus a net loss of EU"
1,"In volume , the focus is already outside Finland , as 60 % of the group 's products are made in Poland and the Baltic countries ."
1,"Of these shares 14,747,084 are held by the Company and the number of outstanding shares and voting rights attached to the shares amounts thus to 161,256,847 ."
2,"Based on strong customer interest and feedback , using RPM mobile phone manufacturers , operators , enterprises and developer forums can significantly increase their product and service quality , user-experience and cost-efficiency '' , Tulonen continues ."
2,"OUTOTEC OYJ PRESS RELEASE DECEMBER 4 , 2009 10.30 AM Outotec establishes a new subsidiary in Kolkata Outotec has established a subsidiary in India in order to better serve its Indian customers and to increase its business in the growing Indian market ."
2,YIT Construction and the town of Riihim+Æki have signed a lease contract whereby the town will occupy the Travel Centre office facilities .
1,Sunrise Resources operates in Russian near-shore development markets through its wholly-owned Russian subsidiary and has 80 % of its personnel in Russia .
1,From Merisatama to the far corners of the world Asfaltti Osakeyhti+¦ Lemmink+Æinen was established in 1910 by a group of master builders in Helsinki as a specialist business and subcontractor .
2,A new production line is being completed for the contract production of hormone treatments .
1,"F-Secure , a developer of security solutions as a service through Internet Service Providers and mobile operators , announced results from its annual Online Wellbeing Survey ."
1,"According to its notice , Skandinaviska Enskilda Banken AB publ Helsinki Branch has on 10 August 2009 divested in total 11,958,000 Alma Media shares to Ilkka-Yhtyma Oyj and Kaleva Kustannus Oy , as the conditions of the agreement made by the companies on 1 July 2009 fulfilled ."
1,The tower 's engineers have created an 18 degree westward lean - four times the inclination on the Leaning Tower of Pisa - using diagrid structures that are aligned geometrically using Tekla Structures BIM ( Building Information Modeling ) software .
2,"KAUKO-TELKO LTD PRESS RELEASE 19.06.2007 AT 14.00 1 ( 1 ) Telko Group ( Kauko-Telko ) is expanding its strategic partnership with BP Industrial Lubricants & Services ( BP ILS ) by acquiring total ownership of BP 's Swedish retail company , Molub-Alloy AB ."
2,"The Bristol Port Company has sealed a one million pound contract with Cooper Specialised Handling to supply it with four 45-tonne , customised reach stackers from Konecranes ."
1,"The inaugural speech will be given by Hannu Kyrolainen , Finland 's Ambassador to the Czech Republic ."
1,Talvivaara is listed on the London Stock Exchange Main Market and NASDAQ OMX Helsinki and is included in the FTSE 250 Index .
2,Metsaliitto said that it will book a minor gain of less than EUR1 .0 m from the transaction .
1,"The works will include the laying of natural stone pavements and the installation of underground heating , and surface water drainage systems ."
1,"Based on negotiations with personnel , some 20 % have indicated their willingness to move to the new location ."
1,The iPad application joins the iPhone app as part of Monster 's range of mobile applications for job hunting .
1,Central Europe is an important market area for Honka .
1,Pharmaceuticals - Spain This brand-new market analysis gives a clear overview of the actual situation and future outlook of the pharmaceutical market in Spain .
1,"The Tecnomen Convergent Charging solution includes functionality for prepaid and post-paid billing , charging and rating of voice calls , video calls , raw data traffic and any type of content services in both mobile and fixed networks ."
1,"New Delhi , Feb. 12 -- Korteniemi Anneli , Helokunnas Tuija , Peltola Marjo , Keskinen Jukka , Salminen Jussi , Tusa Kia and Janhonen Risto of Nokia Telecommunications Oy , Espoo , Finland have developed cable adjustment device ."
0,"Finnish shipping company Finnlines , of the Grimaldi Group , reports its net sales decreased to EUR 241.8 mn in January-June 2009 from EUR 384.0 mn in the corresponding period in 2008 ."
1,"The total investment in the company will be EUR58m , of which Wartsila 's share will be EUR29m ."
0,Stora Chief Executive Jouko Karvinen has described the Russian tariff hikes as a threat to the future of the forest products industry in Finland .
1,"The fixed-term contract of Mr. Jarmo Ukonaho , the current General Manager of Incap 's Indian operations , will finish by the end of the year ."
2,Nordea Group 's operating profit increased in 2010 by 18 percent year-on-year to 3.64 billion euros and total revenue by 3 percent to 9.33 billion euros .
1,"Thanks to its extensive industry and operations experience , Cybercom offers strategic and technological expertise to these markets : telecom , industry , media , public sector , retail , and banking and financial services ."
1,Castecka said the town hall would hold talks with other investors interested in the zone .
2,"In the second quarter of 2010 , the group 's pretax loss narrowed to EUR 400,000 from EUR 600,000 ."
0,Altogether Finnair has canceled over 500 flights because of the strike .
2,Teleste and Sentry 360 have formed an integration partnership between Sentry s advanced 360-degree immersive camera product line and Teleste s enterprise video management systems .
1,He will report to CapMan Plc 's CEO Heikki Westerlund .
0,Elisa CEO Sami Seppanen said EMT 's slogan `` Best coverage across Estonia '' clearly gives misleading information to consumers .
2,"Estonian telecoms company Elisa 's customer numbers cross 400,000 TALLINN , Oct 22 , BNS - The Estonian telecommunications company Elisa won approximately 50,000 new clients in the nine months of this year , bringing the number to 401,800 by the end of September , the company said ."
2,This new partnership agreement represents a significant milestone for both parties .
1,"The new company will likely hold an IPO on the NYSE or another international stock exchange , according to Altimo which manages the Alfa Group 's telecommunications assets and TeliaSonera 's agreement , which has been published on the website of the U.S. Securities and Exchange Commission ."
1,The value of the deal was not disclosed .
2,The effect of the savings will be noticeable as of the beginning of 2010 .
2,"Nokia controls more than 50 percent of phone sales in India and Africa , and has a strong prosition on most other emerging markets ."
1,Finnish component supplier Componenta Corporation ( OMX Helsinki : CTH1V ) reported on Tuesday ( 15 July ) an operating profit of EUR46 .2 m on net sales of EUR386 .0 m for the financial period January-June 2008 .
1,"In addition , nine fixed-term employment contracts will not be extended and two people will leave the company under pension arrangements ."
1,"The company serves customers in various industries , including process and resources , industrial machinery , architecture , building , construction , electrical , transportation , electronics , chemical , petrochemical , energy , and information technology , as well as catering and households ."
2,"Svyturys-Utenos Alus , which is controlled by the Nordic group Baltic Beverages Holding ( BBH ) , posted a 6.1 percent growth in beer sales for January-September to 101.99 million liters ."
2,"Biohit and VWR have been in close cooperation for a number of years in the US , where Biohit is one of VWR 's focus suppliers ."
2,"Separately , YIT Corporation and Austrian firm E AG last week signed an agreement on the sale of E 's building system service business in Germany , Austria , Poland , the Czech Republic , Hungary and Romania for EUR 55 mln ."
1,EUR 152.4 mn of this was net interest income .
1,UPM 's aim is to secure Botnia 's strategic development and investments .
1,The companies aim to close the deal before the end of the year .
0,"The OMX Helsinki index was 0.33 pct lower at 9,364.80 , while the OMX Helsinki CAP portfolio index was down 0.34 pct at 5,029.25 ."
1,The site will cover over six hectares .
1,RIM has revamped the BlackBerry OS UI with the 6.0 version of the mobile operating system .
1,"The devices would be launched in the Chinese market in late 2006 , the company said ."
1,"The estimated value of the contract is EUR12 .4 m. Vaisala , headquartered in Helsinki in Finland , develops and manufactures electronic measurement systems for meteorology , environmental sciences , traffic and industry ."
2,"Consolidated net sales increased 16 % to reach EUR74 .8 m , while operating profit amounted to EUR0 .9 m compared to a loss of EUR0 .7 m in the prior year period ."
1,"Fortum holds 90.2 pct of the share capital and 94.4 pct of the voting rights in the company , which it now plans to delist from the Warsaw Stock Exchange ."
1,"We went to the market with yield guidance of the 7.25 % area , which gave us the flexibility to go up or down by 1-8th ."
0,"As production of other products will continue normally , temporary lay-offs concern simultaneously at most 80 employees ."
2,Finnish Ahlstrom Corporation has ordered key production equipment for a new glass nonwovens production line at its Russian Tver Mill from Finnish Vaahto Pulp & Paper Machinery ( that is part of Vaahto Group ) .
1,The total investment of the project will be approximately EUR 36m .
1,"Commenting on the deal , Shane Lennon , SVP of Marketing & Product Development at GyPSii said : ?"
0,"Cash flow after investments amounted to EUR45m , down from EUR46m ."
1,The contract value amounts to EUR 2.4 million .
1,"The area will also include some central buildings , and Honkarakenne has started negotiations on their delivery ."
0,"Operating profit totalled EUR 30.2 mn , down from EUR 43.8 mn a year earlier ."
1,The price will be specified at the completion date .
2,"W+Ærtsil+Æ 's solution has been selected for its low fuel consumption , environmentally sound technology , and global service support ."
1,Automation makes it possible to conduct several tests simultaneously .
2,Nokia and Elisa will work together to bring a superior mobile gaming experience for Elisa customers .
0,"Due to market conditions , the company will also temporarily lay off about 3,200 people at different sites ."
2,The deal strengthens Ramirent 's position especially in the industrial sector and in large investment projects .
1,The availability of the Internet services is highlighted in the service offer of Kesko 's K-Group stores .
1,"According to business media reports , Usmanov planned to transfer his MegaFon stake to the state-controlled Svyazinvest , in exchange for a stake in the merged RosTelecom ."
2,"The divestment is in line with the company 's plans to focus on selected growth segments and streamline corporate structure , the company explained ."
1,Rapala VMC Corporation ( Rapala ) is a Finland-based company engaged in the manufacture and distribution of fishing equipment and accessories .
2,"London 's leading shares today jumped almost 100 points , or 1.7 % , as the market opened ."
1,"In Finland , the corresponding service is Alma Media 's Etuovi.com , Finland 's most popular and best known nationwide online service for home and property sales ."
1,Financial details were n't disclosed .
1,"Founded in 1946 , Strand Associates , which provides civil , environmental , transportation , electrical and mechanical engineering services , has 350 employees at 10 offices in Wisconsin , Alabama , Illinois , Indiana , Kentucky and Ohio ."
1,"A In August 2007 , Latvijas Finieris ordered all production lines for a new green veneer mill to be built in Ukmerge , central Lithuania ."
1,Aspo 's Group structure and business operations are developed persistently without any predefined schedules .
1,"Back then , Tikkurila 's former owner , Finnish chemicals company Kemira Oyj HEL : KRA1V , distributed an 86 % stake to Kemira shareholders to facilitate the divestment and listing of Tikkurila ."
2,"ADP News - Nov 18 , 2008 - Finnish AC drives manufacturer Vacon Oyj OMX : VAC1V said today that it had set up new representative offices in Romania and Ukraine to serve the growing markets in eastern and southeastern Europe ."
1,Kershaw takes up the position with immediate effect from her previous role as marketing manager of Sankey Home & Garden Products .
2,`` Our customer has been satisfied with Basware Invoice Automation solution and extends the implementation to new geographies .
1,The value of the contracts is about EUR 3.3 mn .
1,"Intellisync Wireless Email from Nokia is a full-featured wireless e-mail solution that connects users to their e-mail , calendar , contacts , notes and task lists while away from the office , according to the company ."
0,"Profit before taxes amounted to EUR 56.5 mn , down from EUR 232.9 mn a year ago ."
2,"HELSINKI ( AFX ) - Metso said it will upgrade one of UPM-Kymmene 's four paper machines at the latter 's mill in Jaemsaenkoski with a new coating color supply system , machine and process controls and quality measurements ."
2,"The negotiations were carried out in a constructive manner , and all parties tried to find a solution to the situation ."
1,The dual-fuel engines of the vessel can operate on liquefied natural gas LNG with low emissions .
1,"Following the issue , the number of shares in the Swedish company will grow by 9 % ."
1,"Vaisala 's Present Weather Detector measures visibility up to 20 km , as well as precipitation type and intensity ."
1,"The maximum grade of the veneer yield is calculated , based on the dimensions and grades of the veneer products , as well as by iterating the places of the peeling axes and simulating the peeling process ."
2,"The fair value of investment properties totalled EUR 2,299.9 mn , compared to EUR 2,229.5 mn in the corresponding period in 2009 ."
1,"The contract value amounts to about EUR11m , the company added ."
0,"( ADP News ) - Feb 4 , 2009 - Finnish broadband data communication systems and solutions company Teleste Oyj ( HEL : TLT1V ) said today its net profit decreased to EUR 5.5 million ( USD 7.2 m ) for 2008 from EUR 9.4 million for 200"
1,The government has instead proposed an exchange of the state 's stake in LMT to TeliaSonera 's stake in Lattelecom .
2,These moderate but significant changes resulted in a significant 24-32 % reduction in the estimated CVD risk .
1,"Water Treatment Products In Australia Today , Global Research & Data Services is going to publish a market analysis about the market for chemical water treatment products in Australia ."
2,"Thanks to his wide contact network and good knowledge of market and business environment , he will give a great contribution to the further development of our Indian operations '' , tells Incap 's President & CEO Juhani Hanninen ."
2,KESKO FOOD LTD PRESS RELEASE 04.01.2006 AT 13.00 Kesko Food Ltd is launching a major TV campaign to recruit as many as one hundred new K-food retailers .
1,"The Lemminkainen Group , headquartered in Helsinki , Finland , operates in all sectors of the construction industry : civil engineering , building contracting , technical building services and the building materials industry ."
0,"`` There 's the issue of thieves stealing them from building sites , '' said Mr Smith ."
1,The company has a wide selection of metal products and services .
