sentiment,article
2,"Exel Composites ' long-term growth prospects remain favourable , however ."
2,"`` They would invest not only in the physical infrastructure , but would also provide know-how for managing and developing science and technology parks , '' said Sunrise Valley director Andrius Bagdonas ."
1,"Elcoteq 's global service offering covers the entire lifecycle of products , from product development to after-market services ."
1,The webcast may be followed online on the company website at www.ruukki.com/investors .
0,"Finnish Food Workers ' Union SEL plans to hasten its collective bargaining with a two-day strike that would begin on 7 April 2010 , in Finland ."
2,Shares of Nokia Corp. rose Thursday after the cell phone maker said its third-quarter earnings almost doubled and its share of the global handset market increased .
0,Finnair 's total traffic decreased by 8.7 % in terms of revenue passenger kilometres .
1,"May 29 , 2010 ( CompaniesandMarkets.com delivered by Newstex ) -- This report provides key data and information on the meat , fish and poultry market in Finland ."
2,"Pretax profit rose to EUR 1,019 mn from EUR 1,007 in the corresponding period in 2005 ."
1,"The EBRD is using its own funds to provide a 21.6 mln A loan while the B portion of 10 mln Euros has been syndicated to two Finnish commercial banks , Nordea Bank Finland Plc 7.7 mln Euros and Pohjola Bank Plc 2.3 mln Euros ."
2,"Dirk Jones , head of Financial Institutions Client Sales Management , GTS , Citigroup , Inc , said , ` Citi is extremely pleased to be providing global custody services to Pohjola Group Bank ."
1,`` Our approach is very much to only use raw materials that are produced in line with the principles of sustainable development .
1,"The tests , conducted at Nokia Siemens ' LTE center of competence in Espoo , Finland , follow the company 's production start of LTE-ready Flexi Multiradio Base Stations for the 800 MHz band in April 2010 , and complement earlier tests with Nokia on the 2100 MHz and 2600 MHz bands ."
2,"Sales VAT inclusive expanded by 19 percent , to 351 million euros ."
1,M. and a Master of Business Administration MBA .
2,"The company 's goal is to achieve annual savings of EUR 2 million ( USD 2.7 m ) , of which two thirds are to be realized in 2010 ."
2,"`` Lidskoe Pivo 's investment program foresees the integrated modernization of production , updating transport and logistics infrastructure and developing new marketing instruments , '' Mikshis said ."
1,The manufacturing will begin in Pietarsaari in the beginning of the year 2009 and the delivery will take place in October 2009 .
1,"Tekla provides 3D software for building and infrastructure engineering , with a focus on building information modelling of steel and concrete structures from design to construction ."
0,Finnish investment group Norvestia Oyj said its net profit fell to 23.5 mln euro $ 30.6 mln in 2006 from 33.5 mln euro $ 43.6 mln in 2005 .
2,"In the beginning of this year , Wartsila had secured an order to deliver four gas-fuelled main engines and propulsion machinery for the same vessel ."
0,"Scanfil , a systems supplier and contract manufacturer to the communications sector , will start personnel negotiations in Oulu , in Finland , to lay off staff temporarily ."
1,Both companies ' existing investment plans will be coordinated .
1,"The total number of voting rights is 74,612,523 ."
1,"In April-June 2008 , Scanfil 's net sales totalled EUR 58.7 mn and operating profit EUR 6.6 mn ."
1,Changes to the as-built models from the design were communicated to the subcontractors to accommodate them into the steel and GRC fabrication process .
1,Rimi supermarket is the key customer in Magistral center .
1,"Tekla will organize an information meeting for analysts and media at WTC Helsinki Marski meeting room , Aleksanterinkatu 17 , the same day at 12:30 - 1:30 p.m. Light lunch will be served ."
1,"Together , Yahoo and Nokia said they will continue to deliver Internet experiences that address the core needs of consumers , developers , operators and advertisers ."
1,Stora Enso will receive a 19.9 pct equity interest in the combined company .
1,The value of the total investment is about EUR 600mn .
2,The plan is estimated to generate some EUR 5 million ( USD 6.5 m ) in cost savings on an annual basis .
1,The solution will now be expanded to include all ground staff tasks .
1,The terms and conditions of Stock Option Scheme 2004 are available on the Group 's website .
2,"`` Lining stone sales were also good in the early autumn , and order books are strong to the end of the year ."
2,Operating result including non-recurring items rose to EUR 146mn from a loss of EUR 267mn in 2009 .
1,"The company operates a U.S. division in Lisle , Ill. ."
1,"The remaining amount will be funded through debt , the Danish bank said ."
2,The layoffs were aimed at reaching an annual savings target of 1.5 billion euros $ 2 billion by the end of 2010 .
2,Finnish food industry companies HK Ruokatalo and Atria will form a joint venture company called L+Ænsi-Kalkkuna to produce turkey meat .
1,The second-quarter net sales are expected to be on par with the first quarter of 2009 .
1,"Cramo 's manager Jarmo Laasanen said hiring of equipment and machinery in Lithuania differs from the other Baltic countries in that in Lithuania still many public structures such as roads , bridges , airports and shops are being built ."
1,COMPTEL CORPORATION Sami Ervio President and CEO Distribution : NASDAQ OMX Helsinki Major media Comptel Dynamic OSS solutions enable telecom service providers to deliver services flexibly and charge them effectively .
1,A broad range of connectivity options including 3G - HSPA and Wi-Fi gives consumers high speed access to the Internet .
0,"UPM said the move will lower net profit by  x20ac 385 million US$ 520 million in the second quarter , mainly due to impairment charges ."
2,Sales have risen in other export markets .
1,"Currently , the plant operates on full capacity ."
1,A paper mill in the central Maine town of Madison soon will have a new owner .
1,"says Brian Burton , Head of IT Security , Vodafone UK ."
2,Rautaruukki said construction group YIT has awarded it a 2.5 mln eur contract to supply the steel structures for a new bridge spanning the Kemijoki river in Northern Finland .
1,"The company designs , manufactures and markets advanced composite products for industrial applications and consumer goods such as cross-country , alpine and Nordic Walking poles , floorball sticks and antenna radomes ."
1,"The utility will also provide services related to electricity management , such as hedging trades and risk management and reporting ."
0,Finnish media company Talentum Oyj 's net profit decreased to 2.5 mln euro ( $ 4.0 mln ) for the first quarter of 2008 from 3.0 mln euro ( $ 4.7 mln ) for the same period of 2007 .
1,"The Filter Tips cover the volume range from 0.1-1200 -ðl including new sizes for 10 , 20 , 100-120 , 200 , 300 , 1000 and 1200 -ðl volume capacities ."
1,"Trading in the new shares , which have right to dividends and other distributions of funds , will start on the exchange in Helsinki tomorrow ."
0,Aspocomp has a large factory in China and a factory building project in India that was halted due to financing problems .
1,In July it and Quadriga Capital sold their Lewa GmbH pump-making business to Japan 's Nikkiso Co. .
0,Border Guard Service has banned the mooring of the company car-shipping ferry on its test travel at the railroad-car terminal of the Russian port as the border checkpoint is not yet ready .
0,The first ship has been delayed and is estimated to be completed in spring 2010 .
1,1 April 2011 - Finnish machinery rental company Ramirent Oyj HEL : RMR1V said today it has acquired the assets of sector player Stavebni Doprava a Mechanizace SDM in the Czech Republic for an undisclosed sum .
1,"Financial , strategic and operational factors are considered ."
2,`` We were the lowest bidders and now the final approval is awaited . ''
1,"The share capital of Basware Corporation is 11,720,829 ."
2,"The growth in the activeness of Talentum 's customers , which started at the end of 2009 , continued during the reporting period , the company stated ."
1,"In 2009 , it reported net sales of approximately EUR 6mn ."
1,"In Russia , Raisio 's Food Division 's home market stretches all the way to Vladivostok ."
1,Russia 's Video International Group holds a controlling stake in Russian Media Ventures .
1,"Finnish diversified holding company Aspo Oyj said on September 8 , 2008 that it will sell the Finnish tape business of its Kaukomarkkinat unit to local Oy Telpak Ab ."
2,The Group aims to increase its net sales and comparable operating profit in 2006 .
1,"At the end of last week , Protalix BioTherapeutics Inc ( AMEX : PLX ) published a prospectus for a first offering on AMEX of about 5 % of its share capital ."
1,"Cramo , headquartered in Vantaa , Finland , rents construction machinery and equipment , as well as rents and sells modular space ."
2,"Operating profit totalled EUR 21.1 mn , up from EUR 18.6 mn in 2007 , representing 9.7 % of net sales ."
2,Sales rose to 300.9 mln eur compared with last year 's 276.1 mln eur and in line with 299 mln eur consensus figure .
1,"The selling consortium includes funds managed by OKO Bank 's venture capital unit , Bio Fund Management and Finnish Industry Investment , a government-owned investment group ."
2,"Both operating profit and turnover for the nine-month period increased , respectively from EUR2 .4 m and EUR43 .8 m , as compared to the corresponding period a year ago ."
1,"In addition to software development , the new design unit will provide for mechanical engineering and electronics design ."
1,"We serve a broad range of customers , including construction and process industries , shipyards , the public sector and households ."
2,"Finnair PLC carried a record 8.8 million passengers in 2006 , an increase of 3.5 percent on the previous year , the Finnish national carrier reported Tuesday ."
2,South African Sappi will become the largest foreign forest industry company operating in Finland as a result of the acquisition Finnish M-real Corporation 's Graphic Papers Business unit .
1,"The sale will allow Campofrio to focus on its recently announced takeover of Groupe Smithfield Holdings , the European unit of Smithfield Foods Inc. ( SFD ) of the U.S."
1,"Oka specialises in new construction , renovation work of residential and non-residential building as well as premises for industrial and logistical use ."
2,The program 's target is structural cost reductions of about EUR 30mn in 2009 .
2,This is the second successful effort for the financial investor this year .
1,Net profit in the same period in 2006 was 36.6 million euros .
2,"Finnish Cargotec 's Kalmar , the business area providing container handling solutions , has been awarded an order for a further ten E-One rubber-tyred gantry RTG cranes from Saigon Newport Company SNP , in Vietnam ."
2,"( ADP News ) - Nov 28 , 2008 - Finnish power-supply solutions provider Efore Oyj ( OMX : EFO1V ) announced today the launch of OPUS DC , the latest power system in its OPUS product line ."
2,The EPS improved to EUR0 .38 from EUR0 .27 .
2,"Pre-tax profit totaled EUR 397.4 mn , up from EUR 164.7 mn ."
2,Finnish mobile operator DNA will function as a subcontractor to Maingate and will be responsible for telecommunications connections .
2,"O'Leary 's Material Handling Services , located in Perth , is the leading company in Western Australia that supplies , installs and provides service for tail lifts ."
2,"Finnish flexible packaging manufacturer Suominen Corporation reports net sales of EUR 54.5 mn in the first quarter of 2008 , compared with EUR 54.3 mn a year earlier ."
2,"` The stable outlook reflects Nokia 's strong market position in the global mobile handset market , strong cash flow generation , and very conservative balance sheet , ' said Raab ."
1,"Technopolis plans to develop in stages an area of no less than 100,000 square meters in order to host companies working in computer technologies and telecommunications , the statement said ."
2,Most of the increase in net sales was due to the acquisition of Swedish Silva that produces garden tools and boats .
1,The Oulu plant employs approximately 120 people .
1,The financial details of the transaction were not disclosed .
1,"Componenta has production lines for similar-sized products at Karkkila in Finland , at Weert in the Netherlands and at Orhangazi in Turkey , and these had a combined output of approximately 100,000 tonnes and net sales of EUR 135 million in 2007 ."
2,The mill has long traditions and holds an established position in the markets .
2,"In July-September 2008 , YIT 's net sales increased to EUR 970.8 mn , compared to EUR 906.8 mn in the corresponding period in 2007 ."
1,"Finnish real estate investor Sponda Plc said on Wednesday 12 March that it has signed agreements with Danske Bank A-S , Helsinki Branch for a 7-year EUR150m credit facility and with Ilmarinen Mutual Pension Insurance Company for a 7-year EUR50m credit facility ."
0,"In the fourth quarter of 2008 , net sales decreased to EUR 121.4 mn from EUR 165.5 mn in the fourth quarter of 2007 ."
2,"`` The change will optimize the operational efficiencies of our growing business , '' said Julia Prohaska , director of marketing communications for Fiskars ."
1,"The change in holdings in accordance with Chapter 2 , Section 9 of the Finnish Securities Markets Act is described below ."
1,"Finnish metal components supplier Componenta on December 26 , 2006 applied for approval with the Turkish Capital Markets Board to launch a mandatory offer for the remaining shares in iron and aluminium castings producer Doktas Dokumculuk ."
2,"Via the Satlan acquisition , Teleste plans to further expand its market presence as a video services partner for cable operators , broadcasters and IPTV service providers ."
1,`` We could be there .
0,"In the Baltic states the company reports net sales of EUR 11.9 mn , down from EUR 14.2 mn , and an operative EBIT of EUR -2.2 mn , down from EUR -1.7 mn ."
2,Operating profit rose to EUR 13.1 mn from EUR 8.7 mn in the corresponding period in 2007 representing 7.7 % of net sales .
2,"`` P&O Ferries now has a very efficient and powerful vessel for its Dover to Calais route , '' head of the shipbuilder 's Rauma yard , Timo Suistio , said ."
1,"The order includes a new Crecent former , headbox , and reel ."
0,"Finnair 's passenger load factor , which measures the number of sold seats as a share of all available seats , dropped by 1.3 percentage points to 76.7 % in September ."
1,Aspocomp intends to set up a plant to manufacture printed circuit boards with an investment of Rs310 crore .
2,The value of the firm 's forestry holdings increased by SEK 3.6 bn .
0,"Operating profit totalled EUR 9.0 mn , down from EUR 9.7 mn in the first half of 2008 ."
0,"Comparable operating profit for the quarter decreased from EUR510m while sales increased from EUR860m , as compared to the third quarter 2007 ."
2,The insurer anticipates its share in Nordea 's net profit to be significant .
1,Total two offers were received by Contracting Authority for participating in this contract ; however the contract was allotted to Affecto Finland Oy .
1,"Sarantel , based in Wellingborough , UK , designs high-performance antennas for portable wireless devices ."
1,Some of the lay-offs will be implemented using part-time employment contracts .
1,"- The Group -“ s sales during the period were EUR 31.6 million EUR 36.6 million , 1-6/2007 and profit before taxes was EUR 0.2 1.3 million ."
2,"Finnish GeoSentric , a developer and provider of solutions , products , and technologies for location based services , has preliminary agreed on a EUR 6mn short-term funding with its leading investor ."
1,"Neste Oil s refineries have a combined crude oil refining capacity of approximately 260,000 barrels a day ."
1,We make available the following brand-new market analyses : Cement - UK Cement - Poland Cement - Belgium These analyses give a clear overview of the actual situation and future outlook of the cement industry in some European countries .
2,"The last quarter was the best quarter of 2009 in net sales , and the operating margin rose to 12.2 % ."
1,"`` As a part of the Eseries business promise , the Nokia E50 has been equipped with a variety of email solutions in a small and stylised package , '' said Dave Grannan , general manager , Enterprise Solutions , Nokia ."
1,"Affecto will provide a new EFI Data Warehouse and reporting solution , behavioural scoring system supporting operational decision processes and Data Migration from old legacy systems to the new EFI system ."
1,"In 2010 , the Marimekko Group s net sales were EUR 73,297 thousand ( EUR 72,473 thousand ) and operating profit was EUR 8,169 thousand ( EUR 6,291 thousand ) ."
0,Finnish forest industry group Stora Enso Oyj issued on Thursday ( 20 March ) a profit warning for the first quarter 2008 .
1,"Besides , as there is no depositor preference in Finland , senior debt and deposits rank on a par , which is also taken into consideration , the agency added ."
0,Repeats sees 2008 operating profit down y-y ( Reporting by Helsinki Newsroom ) Keywords : TECNOMEN-RESULTS
1,"Local government commissioner of +_m+_l , Kurt Svensson , says he will contact the management of Finnish company Componenta to find out if there are any alternatives to the company 's decision to close down its plant in +_m+_l ."
2,"Finland-based Elcoteq SE , a privately held provider of electronics manufacturing services to communications companies , said Thursday it signed a long-term manufacturing supply deal with communications equipment company Andrew Corp. ."
2,The EPS outlook was increased by 5.6 pct for 2007 and 7.0 pct for 2008 .
1,Renesas Mobile Europe Ltd has approximately 470 employees in Oulu .
1,"Our solutions are fully Arabized , and our message is that we want to become the IT partner of choice for businesses in the Near-East region ."
2,"There are companies , which are ready to invest their own funds in this deal such as Rostelecom RTS : RTKM ."
2,Finnish Vacon has signed significant deals with Norwegian Scandinavian Electric Systems ( SES ) on the supply of AC drives .
1,"Finnish silicon wafers maker Okmetic Oyj said on September 17 , 2008 that it will invest a total of 15 mln euro $ 21.3 mln in its sensor wafer business ."
0,"26 October 2010 - Finnish environmental management company Lassila & Tikanoja Oyj ( HEL : LAT1V ) , or L&T , said today its net profit declined to EUR20 .9 m for the first nine months of 2010 from EUR27 .6 m for the same period a year earlier ."
0,"Net sales for the financial year 2006 are expected to amount to about EUR20m and the operating result EBIT is expected to be a loss , as announced before ."
2,"I use natural fibers to make the clothes more comfortable , to allow your skin to breathe and to be eco-friendly ."
1,Increase in the number of shares is based on the option rights which were granted to the management of the company under the stock option plan 2006 .
1,"M-real generated a turnover of EUR5 .6 bn in 2006 and has 15,500 employees ."
1,"CHS Expo Freight is a major Finnish fair , exhibition and culture logistics company that provides logistics services to various events by land , air and sea ."
2,"According to Ringman , Finnish paper companies have acquired know-how and capacity in paper recycling , which has turned out to be a successful strategy ."
1,It is expected to be completed by the end of 2007 .
1,"Mr Ashley , deputy executive chairman of Sports Direct , sold a 43pc stake in the company for more than pounds 900m at the time of the float ."
2,"4 February 2011 - Finnish broadband data communication systems provider Teleste Oyj HEL : TLT1V said Wednesday its net profit rocketed to EUR4 .8 m in 2010 from EUR416 ,000 in 2009 and it lifted its dividend proposal ."
1,"Ruukki 's delivery includes steel structures , including installation , for Krakeroy bascule bridge and steel piles for the bridge foundations ."
1,The agreement includes the entire process of managing Mercator 's supply chain in all regions where the company is currently present .
1,"H1 '08 H1 '07 Q2 '08 Q2 '07 in mln euro , unless otherwise stated Net sales 386 328.6 201 160.7 Operating profit 46.3 35.8 23.2 9.5 Pre-tax profit 33.6 26.9 18.7 5.1 Net profit 25.1 25.4 14 4.0 EPS in euro 2.20 2.36 1.24 0.38 1.0 euro = $ 1.60 www.componenta.com"
1,Finnish silicon wafer technology company Okmetic Oyj OMX Helsinki : OKM1V said on Wednesday 17 September that it will invest EUR6m in its sensor wafer business during 2009 .
1,Finnish stainless steel manufacturer Outokumpu in Degefors is planning to recruit new engineers in order to meet a retirement wave over the next few years .
2,Our standardised services have met with a positive reception among our customers as well as at Itella .
2,Finnish Raute Precision has won large glass batch plant and mortar plant orders from Mexico and the US .
1,"Chic and cheerful , Finnish design house Marimekko has been sending its geometric textiles out into the world for the past 60 years ."
0,"Currently , the company foresees its pre-tax profit to remain below the 2009 level when it reached EUR 700,000 USD 934,000 , compared with previous projections of a slightly better pre-tax profit ."
1,"The shares shall be repurchased through public trading , for which reason the shares are repurchased otherwise than in proportion to the holdings of the shareholders ."
2,"SOUTHFIELD , Mich. -- Central Corporate Credit Union will again distribute patronage dividends to members by waiving all service fees incurred during the months of July and November 2008 , to the tune of an estimated $ 1 million ."
2,"A portion , $ 12.5 million , will be recorded as part of its winnings in a prior patent dispute with Finnish phone maker Nokia Oyj ."
1,Finnish paper maker UPM-Kymmene Corp. on Monday announced the sale of its wrapping unit Walki Wisa to the CapMan investment group in a move to further concentrate on its core business .
1,"Sanoma Learning & Literature , offering print and digital learning materials , is present in eleven countries ."
1,Nokia Corp of Finland Tuesday said it has received a unified device managment contract with Finnish operator Elisa Oyj .
2,"In January-September 2009 , the Group 's net interest income increased to EUR 112.4 mn from EUR 74.3 mn in January-September 2008 ."
1,Talvivaara Mining Company Plc Talvivaara Mining Company is an internationally significant base metals producer with its primary focus on nickel and zinc using a technology known as bioheapleaching to extract metals out of ore .
1,No financial or pricing details were disclosed .
0,Net sales dropped by 6 % year-on-year to EUR 11.9 million .
2,The sale will lead to a pretax capital gain of EUR 22 million for the Finnish company in 2011 .
1,"Glaston 's well-known brands are Bavelloni , in pre-processing machines and tools , Tamglass and Uniglass , in safety glass machines and Albat + Wirsam in software solutions ."
1,The contract covers new energy-efficient AC drives that have been designed in cooperation between the companies .
1,No financial details were available .
1,The turbines are expected to be launched by the end of 2012 .
1,Radiation and today is a full service house expert in radiation and nuclear safety issues .
2,"In future , the company intends to look for know-how from outside the company and to cooperate with other actors in the sector ."
1,Technopolis 's technological centers supply their clients with modern high-class premises .
1,"For 2009 , net profit was EUR 3 million and the company paid a dividend of EUR 1.30 apiece ."
1,Customers in a wide range of industries use our stainless steel and services worldwide .
2,"Sales came in at 241 mln eur , compared with 211.4 mln , and also beating consensus forecasts of 235 mln eur ."
1,"- The Group -“ s profit before taxes was EUR 0,2 7,8 million ."
2,"We are very excited working with Maxis on this first commercial deployment of ` Master of Maya ' , said Joe Doering , Head of the Asia South region at Nokia Siemens Networks ."
1,The report contains category level company and brand share as well as distribution share information for 2007 and 2008 .
1,"In today s business , you have to pre-empt what consumers want , said Mohammed Zainalabedin , General Manager , Zain Bahrain ."
2,The company will make its marketing and sales investments initiated in 2009 even more efficient in 2010 .
1,Absolut Bank is exploring the possibility of further borrowing .
2,"Both operating profit and net sales for the six-month period increased , respectively , from EUR13 .8 m and EUR143 .6 m , as compared to the corresponding period in 2007 ."
0,"Operating profit was EUR -0.1 mn , down from EUR 1.3 mn ."
0,The Department Store Division 's sales fell by 8.6 % to EUR 140.2 mn .
2,"And the broker repeated its ` buy ' rating , based on expectations that current restructuring will lead to a clear improvement in performance in Europe in 2007 ."
1,"Stockholm , 3 March 2011 About Cybercom The Cybercom Group is a high-tech consultancy that offers global sourcing for end-to-end solutions ."
2,"`` It gives us a sense of pride and exposure , '' said Bruce Hansen , the SVH sales representative for Wolverine ."
2,"Ragutis , controlled by the Finnish brewery Olvi , achieved a 5.7 percent rise in beer sales to 22.6 million liters and held a 10.75 percent market share ."
2,"In a release , the Company said that Vocollect T2 customers in North America can now take advantage of its Voice Directed Warehousing solution and increase warehouse efficiency and productivity gains at a discounted price ."
1,"`` The biggest challenge was to make the piece look raw , '' Hansen said ."
