sentiment,article
1,26 January 2011 - Finnish software solutions provider Basware ( HEL : BAS1V ) said yesterday it adjusted its strategy and goals for the next four years with focus on international growth mainly via acquisitions .
2,"Return on investment was 5.0 % , compared to a negative 4.1 % in 2009 ."
1,"UPM-Kymmene www.upm-kymmene.com produces magazine papers and newsprint , as well as fine and specialty papers , converting materials and wood products ."
1,"Consisting of seven interconnected units , Mega Image 's logistics center will be 347 metres in length and 12 metres in height ."
2,`` We 've been feeling quite positive about the region as a whole .
1,"Glaston , headquartered in Tampere , Finland , is a growing and international glass technology company ."
2,"Known as Post Bank , the concept would see Fidelity Bank rolling out 75 offices in Ghana Post premises , to provide financial services to the people ."
1,"The company is owned by the State of Finland and the European Aeronautic Defense and Space Company EADS N.V. Tekla is an international software company that provides solutions for building and construction , energy distribution and municipalities ."
1,Neste Oil will offer outplacement services to the 111 employees to be reduced .
2,"Aspo Plc STOCK EXCHANGE RELEASE February 11 , 2011 at8 .45 a.m. ESL Shipping Ltd , part of Aspo Group , has signed a new , long-term contract with Rautaruukki Corporation for the marine transport of raw materials on the Baltic Sea ."
0,The total number of filling stations has been on the decrease recently .
1,"In June it sold a 30 percent stake to Nordstjernan , and the investment group has now taken up the option to acquire EQT 's remaining shares ."
0,The sales of the Tiimari segment fell by 4.0 % year-on-year to EUR3 .3 m in June 2010 .
2,"According to CEO Matti Karppinen , Frozen Foods posted a good result in 2010 , as it did in 2009 ."
1,"The 5,000 megawatt wind farm being planned in Raahe would be built offshore in front of Ruukki 's Raahe Works ."
1,The new plant is planned to have an electricity generation capacity of up to 350 megawatts ( MW ) and the same heat generation capacity .
1,It was decided that the auditors are reimbursed according to invoice .
1,"At some point in 2010 , all separate company names , such as Palmberg , Tekmanni , Lemcon , Forssan Betoni , Suonenjoen Betonituote , among others , will disappear ."
2,Atria Group is a leading Scandinavian meat products group .
1,"It is positive that the company it recruited Harri Koponen as CEO , according to Affarsvarlden ."
1,"About 72 % of Evraz Group shares are owned by Lanebrook , whose beneficiaries , on the one hand , are Millhouse , the holding company for the assets of billionaire Roman Abramovich and his business partners 50 % ; and Evraz executives Alexander Abramov and Alexander Frolov 50 % , on the other ."
1,"These include software development for internet and mobile telephone content , communications , value-added software , financial services , security applications , systems integration and electronics ."
1,Teleste expects to start the deliveries at the end of 2009 .
0,"As a result of the negotiations , the company will terminate total 5 employment contracts ."
1,"It is the last smartphone running Maemo 5 , which is to be replaced with MeeGo , a joint project between Nokia , Intel and the open source community ."
1,"Maximum amount of terminations in Finland is 40 employees , the company added ."
2,"Operating profit of Kauppalehti group rose to EUR 1.5 mn from EUR 1.3 mn , and that of Marketplaces to EUR 1.3 mn from EUR 1.0 mn in the third quarter of 2006 ."
0,Consolidated operating profit from continuing operations decreased by 62.3 % to EUR 51.2 mn from EUR 135.7 mn in 2007 .
2,"The company 's order book stood at 1.5 bln euro $ 2.2 bln on September 30 , 2007 , up by 24.2 pct on the year , with international orders amounting to 365 mln euro $ 534.3 mln ."
2,"In Middle East & North Africa , Tecnotree has grown considerably in the recent years ."
1,"Includes company and brand share data by category , as well as distribution channel data ."
2,"In Lithuania , operating profit rose to EUR 190,000 from EUR 70,000 in the corresponding period in 2005 ."
2,"ADP News - Feb 25 , 2009 - Finnish printed circuit board PCB maker Aspocomp Group Oyj HEL : ACG1V said today it swung to a net profit of EUR 300,000 USD 385,000 for 2008 versus a net loss of EUR 65.3 million"
1,"The deal , already approved by shareholders , will be carried out in the first half of 2011 ."
1,"Elsewhere , the tendency is towards more developed packaging than before ."
1,"As of August 2008 , Glaston 's North Asian sales and service region is upgraded to a new market area , North Asia ."
1,The group had an order book of EUR 7.74 mn at the end of 2007 .
1,"BAWAG - Is to issue a benchmark , covered deal ."
2,"In the first nine months of 2010 , the company 's net loss narrowed to EUR 415,000 from EUR 7.4 million for the corresponding period of 2009 ."
1,"According to Pietinalho , doctors should motivate their patients who smoke every time they visit their doctors ."
1,- Cash flow from operating activities before investments was EUR 7.6 million EUR 2.5 million .
1,"According to Finnish Scanfil 's founder and chairman of the board , Jorma J. Takanen , the company has to look for growth abroad ."
1,`` There is no room to modify the share component as we have already indicated . ''
1,The Company turnover amounted to MEUR 27.9 in 2007 .
1,"According to Tyrv+Æinen 's estimation , Japan is a very essential location in terms of Finnair 's Asian strategy ."
1,"Product coverage : baked goods ; biscuits ; breakfast cereals Data coverage : market sizes historic and forecasts , company shares , brand shares and distribution data ."
0,"( ADPnews ) - Dec 1 , 2009 - Finnish cutlery and hand tools maker Fiskars Oyj Abp ( HEL : FISAS ) said today that it will make redundant a total of 18 office and management staff members of its subsidiary Iittala Group Ltd. ."
0,"At 12.59 pm , the OMX Helsinki 25 index was 0.32 pct lower at 2,694.81 ."
1,"Westend ICT Plc s new 409,665,891 shares and increase of share capital with EUR 2,000,000 based on the resolutions of extraordinary shareholders meeting on 27 December 2010 have today registered in the Trade Register ."
1,Shares will be acquired in accordance with section 5 of the rules of NASDAQ OMX Helsinki and other rules applicable to the acquisition of own shares .
0,"TeliaSonera 's underlying results however included 457 mln skr in positive one-offs , hence the adjusted underlying EBITDA actually amounts to 7.309 bln skr , clearly below expectations , analysts said ."
0,"In the first half of 2008 , the Bank 's operating profit fell to EUR 11.8 mn from EUR 18.9 mn , while net interest income increased to EUR 20.9 mn from EUR 18.8 mn in the first half of 2007 ."
2,"Mika Stahlberg , VP F-Secure Labs , said , `` We are excited and proud that F-Secure has been recognized by AV-Comparatives as the Product of the Year ."
1,"Remote Phone Management demonstrates SysOpen Digia 's unique end-to-end offering for operators , handset manufacturers and enterprise customers ."
1,"Its product portfolio comprises harvesters , forwarders , harvester heads , as well as cranes and loaders ."
0,"Operating profit totaled EUR 6.7 mn , down from EUR 7.2 mn in the corresponding period in 2005 ."
1,The right margin will be viewed separately in detail with every customer .
1,"The company will try to adapt the operations through temporary lay-offs of different duration , working hour arrangements , training and development efforts ."
1,"Finnish Kemira Group 's CEO , Lasse Kurkilahti , says the Group 's structural reorganisation will continue for at least a year ."
2,"Finnish-owned contract manufacturer of electronics Elcoteq Hungary Kft has announced plans to recruit more than 650 new staffers to fulfill new orders in P+_cs , where the company has two plants ."
1,The event can be followed on-line via Orion 's Finnish homepage at www.orion.fi as well as via the Kauppalehti Live web service at www.kauppalehti.fi/live .
1,"The wireless industry is bracing itself for the iPhone , which will launch on June 29 ."
0,"Raute reported a loss per share of EUR0 .86 for the first half of 2009 , against EPS of EUR0 .74 in the corresponding period of 2008 ."
2,"( ADPnews ) - Nov 9 , 2009 - Four companies have agreed to buy for a combined SEK 5.9 billion ( USD 854m-EUR 571.8 m ) all drug stores offered for sale as part of the restructuring of Swedish stated-owned pharmacy monopoly Apoteket AB , t"
1,The company negotiated an amendment to the financial covenants of the present credit agreements in regard to the situation on 30 September 2010 .
1,Finnish Civil Aviation Administration decided to temporarily reopen Finnish capital 's Helsinki airport since 3 p.m. to 11 p.m. Monday local time .
2,The company feels these leases are prime locations due to several producing formations in the immediate area .
1,Elisa will expand the use of this technology provided the pilot proves successful .
1,"Jeder Beta-Tester erh+Ælt kostenlos sechs Monate lang Updates und hat laut eigener Aussage die M+¦glichkeit , die finale Version zu beeinflussen ."
2,The policy was also aimed at making the companies more profitable and competitive .
1,The figure does not include food exports from Finland .
1,`` I see my new post as an inspiring challenge .
1,Their offering also covers localisation services related to production transfer to the Finnish company 's customers that already have production in Asian market or have made the decision to transfer production there .
0,"A total of 16.5 mn passenger ship journeys took place in the northern Baltic Sea in 2007 , slightly down from 16.5 mn in 2006 ."
1,Around 50 percent of the world 's ro-ro fleet is over 25 years old and needs to be scrapped for environmental reasons .
1,"Panostaja treats its negotiating partners , such as entrepreneurs selling their life s work and newcomer entrepreneurs seeking a career , fairly , justly and according to the law ."
2,The Group also has a strong global position in other fishing categories .
0,"Finnish plumbing and heating systems supplier Uponor 's net sales in continuing business operations decreased to EUR 249.1 mn in July-September 2008 , compared to EUR 262.1 mn in the third quarter of 2007 ."
1,"The total investment in the Vantaa plant extension will amount to around 10 million euro , and Okmetic 's share of the investments will be worth around 2.7 million ."
1,It 's not .
2,"Pearl Plaza LLC , the joint venture of SRV and Shanghai Industrial Investment Holdings Co Ltd , has concluded the investment decision on construction of the first phase of the shopping center in Saint Petersburg , Russia ."
0,"Result before taxes decreased to nearly EUR 14.5 mn , compared to nearly EUR 20mn in the previous accounting period ."
1,"Community gardening has become a popular activity , especially to raise vegetables ."
1,"Altona stated that the private company of Altona chairman Kevin Maloney , Tulla Resources , would take up its entitlement in full ."
2,EuroChem CFO Andrey Ilyin said : `` This facility marks another important step for EuroChem in securing the long-term financing necessary for our potash and other strategic projects '' .
2,Net sales increased to EUR193 .3 m from EUR179 .9 m and pretax profit rose by 34.2 % to EUR43 .1 m. ( EUR1 = USD1 .4 )
1,"The company 's US subsidiary Vaisala Inc. acquires Aviation Systems Maintenance , Inc ASMI , a Kansas , U.S. based airport service company with over 2.6 million USD net sales in 2008 ."
1,"Wayne Greensmith , Fiskars Brands UK senior brand manager , said : `` We have launched this as we want to give something back to the community ."
1,The board of directors also proposed that a dividend of EUR0 .20 per outstanding share be paid .
1,"Global Markets Direct 's Pohjola Bank plc - Financial Analysis Review is an in-depth business , financial analysis of Pohjola Bank plc. ."
1,"At the same time , the market for automated liquid handling devices is already larger than that for pipettes , according to Biohit ."
1,More than 80 special events in the three counties during four months were hosted by the library system and its nine branch libraries .
2,"Then , it said the contract was estimated to contribute more than EUR150m to its net sales in 2010 ."
2,"`` This is a significant milestone for Benefon , helping us to secure critical USP 's for our personal navigation product roadmap for 2007 and beyond , '' commented Simon Button , Chief Technology Officer at Benefon ."
1,The ship unloader is totally enclosed along the entire conveying line to the storage facilities .
1,Ixonos will finance the acquisition through a 3.8 mln euro $ 5.2 mln loan .
1,"The venture , which will be 51 % owned by Kemira and 49 % by IVRCL , will operate an inorganic coagulant manufacturing facility , to be built in Vishakapatnam Vizag in the state of Andhra Pradesh and to kick off operations in the second half of 2011 ."
1,The original contract was signed last summer .
2,Both the net sales and operating profit were record high in the company 's history .
1,SHARE REPURCHASE 11.01.2008 In the Helsinki Stock Exchange On behalf of Sampo plc Danske Bank A-S Helsinki Branch
1,"In Finland , the five largest brands control 90 % of the beer market ."
1,"industry in Asia +ˆ Pakistan , Malaysia , Taiwan and Philippines Today , Global Research & Data Services is going to publish several market analyses about the cement markets in Asia ."
1,"Construction work on the Helsinki Music Centre is to start this autumn , with the total cost of the project estimated at 140 million euros ."
0,"Operating profit for the 12-month period decreased from EUR17 .9 m while net sales increased from EUR58 .3 m , as compared to 2007 ."
1,Production at the plant will be based on Neste Oil 's proprietary technology that can use a flexible input of any vegetable oil or animal fat .
1,For the new shares subscribed with stock options all shareholder rights commence from the date on which they are entered into the Trade Register .
1,The company will release its 2010 results on 11 February 2011 .
1,I thank Jarmo Ukonaho warmly for his contribution and wish him all the best in the future challenges . ''
1,According to an  posted by the World Intellectual Property Organization : `` The present invention relates to hydrocarbons and particularly to the manufacture of hydrocarbon components suitable as aviation fuels or jet fuels and as blending stocks for aviation fuels .
1,The acquisition price was not disclosed .
0,"According to Swedish authorities , traces of the very toxic osmium tetroxide have been found on the coast of Per+Æmeri , the Northernmost part of the Gulf of Bothnia ."
1,"Jussi Pesonen , member of the Sampo Board since 2006 , will renounce his seat in Sampo Board ."
2,"With CapMan as a partner , we will be able to further develop our business and continue to focus on providing quality restaurant services for our customers , '' says Christopher Wynne , CEO of Papa John 's Russia ."
1,"The total size of the complex is around 25,000 m2 and the project will be constructed in stages ."
1,"`` My wife is looking forward to getting a paycheck again , '' he quipped recently as a six-knot current swirled around his anchored and heavily sponsored jet sled ."
2,"Kemira Coatings is the leading supplier of paints in Northern and Eastern Europe , providing consumers and professionals with branded products in approx ."
2,Global Banking News - 28 September 2010 Tieto Corporation and Pohjola Bank ( PINK : POJLF ) are to cooperate on SWIFT services .
1,"FinancialWire tm is a fully independent , proprietary news wire service ."
1,"In 2007 , the Group 's net sales stood at EUR 22 million and it had about 150 employees at the end of June , 2008 ."
0,"Finnish Scanfil , a contract manufacturer and systems supplier for communication and industrial electronics reports net sales of EUR 108.7 mn in the first half of 2008 , down from EUR 111.1 mn a year earlier ."
1,"The Liquid Handling segment offers laboratory equipment and accessories , including mechanical and electronic pipettes , and disposable tips used in the research institutions , universities , and hospitals , as well as in the pharmaceutical , food , and other industries under the Biohit brand ."
1,This would be a huge process .
2,"Ruukki has signed a contract to deliver and install the steel structures for a bridge over the Kyronsalmi strait in Savonlinna , Finland ."
1,Another problem is cola-flavoured long drinks .
2,"HELSINKI ( AFX ) - Shares closed higher , led by Nokia after it announced plans to team up with Sanyo to manufacture 3G handsets , and by Nokian Tyres after its fourth-quarter earnings report beat analysts ' expectations , dealers said ."
1,"Further concrete cooperation is also carried out through various projects , doctoral theses and diploma dissertations ."
1,"Latin America currently accounts for approximately 40 % of sales at Finnish BSS-OSS and VAS supplier for telecoms operators Tecnotree , company president and CEO Eero Mertano told BNamericas ."
0,Earnings per share ( EPS ) amounted to a loss of to EUR0 .06 .
2,"In January-September 2007 , Finnlines ' net sales rose to EUR 505.4 mn from EUR 473.5 mn in the corresponding period in 2006 ."
2,"Nokia bought Chicago-based Navteq in 2008 , acquiring a maps database to compete with Google s maps as well as with navigation device companies such as TomTom NV and Garmin Ltd. ."
0,"20 October 2010 - Finnish environmental management company Lassila & Tikanoja Oyj HEL : LAT1V , or L&T , said Monday it expects its operating profit , excluding non-recurring items , for the whole 2010 to be slightly lower than in 2009 ."
1,"Ponsse plans to create a network that is based on strong partnership , and participates in the production of larger entities than presently ."
1,"Tieto in Latvia is represented by IT services companies TietoEnator Alise and TietoEnator , which has operations in the industries of Financial Services Cards , Retail and Logistics and IT Outsourcing and Managed Services ."
2,"Vaahto , which has entered the deal via its subsidiary Vaahto Pulp & Paper Machinery , will supply two of the units in the end of 2010 , while the remaining ones are expected for delivery in the beginning of 2011 ."
1,"The commission found evidence of several meetings to discuss the cartel , including one in a Brussels restaurant in November 1997 at which the companies discussed price increases ."
1,"Sanoma also has an Executive Committee , in accordance with the Company 's Articles of Association , that prepares proposals for matters to be decided or noted by the Board of Directors ."
1,"Poyry 's contract includes engineering management , civil and detail engineering services , and time scheduling and procurement services ."
1,"Under the agreement , Japrotek will deliver nine storage tanks in the volume range of 1,000 cu m to 3,000 cu m with included agitators ."
1,"Additionally , the company will use the solutions to automate the preparation of financial statements according to IFRS standard ."
0,"Operating profit for the 12-month period decreased from EUR157 .5 m , while net sales increased from EUR634 .3 m , as compared to 2007 ."
1,Swedish Wallenberg family controlled Investor has bought a large stake of C shares in Swedish retail bank SEB .
0,"( ADP News ) - Jan 22 , 2009 - Finnish mobile phones maker Nokia Oyj ( OMX : NOK1V ) said today its operating profit decreased to EUR 5 billion ( USD 6.5 bn ) for 2008 from EUR 8 billion for 2007 ."
1,"Nokia said it still expects to sell 150 more million Symbian devices in years to come , giving an indication of how it expects the Phone 7 handoff to work ."
1,- Profit before taxes was EUR 105.9 82.7 million .
2,"is planning to expand its product portfolio in the harbor segment , chief executive Pekka Lundmark told Financial Times Deutschland ."
2,"STX Finland Oy signed a a preliminary agreement for the building of an environmentally friendly , new generation cruise ferry for Viking Line to manage on between Turku , Finland , and Stockholm , Sweden withViking Line ABP ."
2,"Adanac Molybdenum of Canada has ordered grinding technology for its molybdenum project in British Columbia , Canada , while Shalkiya Zinc of Kazakhstan has awarded a contract for grinding technology for the Shalkiya zinc-lead project in Kazakhstan ."
1,The company will propose a dividend of EUR0 .12 per share for 2008 .
1,The final outcome of the rights offering is to be reported around 23 October 2009 .
1,"Fiskars is also engaged in the global supply of marine and energy equipment solutions and services through its associated company , Wartsila Corporation ."
1,Rautaruukki aims to find work from the group 's other locations for those who have been made redundant .
0,"In addition , the company will reduce a maximum of ten jobs ."
1,"Ahlstrom Corporation STOCK EXCHANGE ANNOUNCEMENT 7.2.2007 at 10.30 A total of 56,955 new shares of Ahlstrom Corporation have been subscribed with option rights under the company 's stock option programs I 2001 and II 2001 ."
1,"SCOPI Chief Business Excellence Officer , Eng ."
0,Earnings per share ( EPS ) amounted to a loss of EUR0 .38 .
1,Margin call of Zanadvorov has given the chance to make such purchase under the credit of Deutsche Bank for USD 560 million .
1,"`` These patronage refunds reward members that use the fee-based services that make a positive contribution to CenCorp 's operating results , '' said Bill Walby , CenCorp CEO ."
1,The Group 's revenue in 2009 amounted to EUR 70 million and the company currently employs approximately 780 people .
1,Earnings per share EPS in the first quarter amounted to a loss of EUR0 .20 .
1,"Also Ruukki Construction , Rautaruukki 's construction division , is initiating employer-employee negotiations at its sites in Alaj+Ærvi , Vimpeli and Per+Æsein+Æjoki in Finland ."
2,"The most loyal customers were found in the Bank of +_land , with an index of 8.0 ."
0,Operating profit fell to EUR 15.1 mn from EUR 24.6 mn in 2006 .
2,Other carriers and handset makers spin it as a positive event that will raise interest for higher-end phones and pricier data plans .
1,Aspo has also investigated the sales opportunities of Kaukomarkkinat 's electronics business .
0,"The company 's profit before taxes fell to EUR 21.1 mn in the third quarter of 2008 , compared to EUR 35.8 mn in the corresponding period in 2007 ."
0,"Commission income decreased to EUR 3.8 mn , compared to EUR 4.6 mn in the third quarter of 2007 ."
2,"To prove the efficiency of the China Mobile system , Rod Baber , an English climber , climbed to the Mount Everest summit and successfully made calls ."
1,It moved into the No. 2 spot in 2000 when it merged steel operations with Avesta Sheffield to form AvestaPolarit .
2,Uponor improved its performance in spite of the decrease in residential construction in the US .
2,The representative body of Swedish Meats approved an improved offer from Finnish HK Ruokatalo to acquire the company .
0,down to EUR5 .9 m H1 '09 3 August 2009 - Finnish media group Ilkka-Yhtyma Oyj ( HEL : ILK2S ) said today its net profit fell 45 % on the year to EUR5 .9 m in the first half of 2009 .
1,"Based in Helsinki , Finland , Ramirent has branches in 13 Nordic , central and Eastern European countries ."
1,"The broad-based WIG index ended Thursday 's session 0.1 pct up at 65,003.34 pts , while the blue-chip WIG20 was 1.13 down at 3,687.15 pts ."
2,"( ADP News ) - Nov 3 , 2008 - Finnish cargo handling systems and services company Cargotec Oyj ( OMX : CGCBV ) said today that it acquired 80 % stakes in Italian service companies CVS Technoports Srl and CVS Service Srl from Italian handli"
1,No changes in media activity were seen in October compared with September .
2,"Clothing retail chain Sepp+Æl+Æ 's sales increased by 8 % to EUR 155.2 mn , and operating profit rose to EUR 31.1 mn from EUR 17.1 mn in 2004 ."
2,Production capacity will increase from 36 000 to 85 000 tonnes per year and the raw material will continue to be recycled paper and board .
1,"Aug. 31 , 2009 (Gawker Media delivered by Newstex)-- If you love fishing video games but felt that there just was n't enough wackiness involved , then Activision 's (NASDAQ : ATVI) Rapala : We Fish might just catch your eye with its family-fun hook ."
1,"The Polish business employs about 1,000 people , and it had net sales of about EUR 70mn in 2007 ."
2,"`` This contract demonstrates our ability to apply our minerals and metals technologies in adjacent industries , such as oil shale processing ."
1,"In the end , Sanoma News wants to secure its foundation with the savings ."
1,"Later on , about 150 Finnish-made houses will be build in the area ."
1,"Kemira , headquartered in Helsinki , Finland , is an international chemicals group comprising the business areas Kemira Pulp & Paper , Kemira Water , Kemira Specialty and Kemira Coatings ."
2,Operating profit rose to EUR 1.6 mn from EUR 1.1 mn in the corresponding period in 2006 .
0,Finnish Bank of +_land reports its operating profit fell to EUR 4.9 mn in the third quarter of 2007 from EUR 5.6 mn in the third quarter of 2006 .
2,"These financing arrangements will enable the company to ensure , in line with its treasury policy , that it has sufficient financial instruments at its disposal for its potential capital requirements ."
1,Finnish power company Fortum reports 89 % of its electricity was generated without carbon dioxide emissions in 2007 .
1,"GeoSentric is acquiring extra financing by issuing a maximum of 220,000 new shares and a convertible bond with subscription rights for 880,000 shares , which have been fully subscribed ."
0,"In January-November 2009 , the group 's sales totalled EUR 7,801.7 mn , which was a drop of 12.6 % from the same period of 2008 ."
