sentiment,article
2,"`` We are very pleased to be working with Fujitsu and NTT DoCoMo to advance the progress of LTE , '' said Juergen Walter , Head of Converged Core , Nokia Siemens Networks ."
2,"`` Several growth initiatives in the chosen geographic areas are already ongoing , '' it continued , noting Lindex opened its first store in the Czech Republic this autumn in Brno ."
2,Satama 's net sales would be higher than the year before .
1,"The expanded agreement covers the sale , marketing and distribution of Benefon 's navigation and locator devices in China ."
1,Sanoma will continue to focus on investing in digital media and on strengthening its market positions .
1,"Apart from Nordea , also Ergo is competing for the position among the top three pension funds providers in Estonia ."
1,The company has some 410 employees and an annual turnover of EUR65 .4 m. Vaahto Group is listed on the Nordic Exchange in Helsinki .
1,"Following the move , Stora Enso holding in NewPage will remain unchanged ."
0,"`` We can say that the number of deals has become normalized by the moment , and therefore we have decided to devalue our apartments now on sale , '' he added ."
1,"The port facilities ' throughput is 250,000 TEUs and 7.5 mln tons of general cargo ."
2,"Revenue from July to September grew 21 percent to EURO 2.3 billion , the Finnish company said Thursday ."
1,"Amer , which bought Salomon from adidas in October , said the job cuts are aimed at boosting competitiveness ."
1,"Linde acts responsibly towards its shareholders , business partners , employees , society and the environment - in every one of its business areas , regions and locations across the globe ."
1,The service developed by Digia facilitates the work and resourcing of health care personnel during vaccination campaigns while providing them with monitoring and management tools .
2,Our superior customer centricity and expertise in digital services set us apart from our competitors .
2,"In the second quarter of 2010 , the group 's net profit rose to EUR3 .1 m from EUR2 .5 m in April-June 2009 ."
2,"Finnish steel maker Rautaruukki Oyj ( HEL : RTRKS ) , or Ruukki , said today its net loss contracted to EUR 49 million ( USD 68.2 m ) for the first nine months of 2010 from EUR 229 million for the same period a year ago ."
1,"At the moment , there are approximately 20 Vianor sales offices in Russia ."
2,Kone 's net sales rose by some 14 % year-on-year in the first nine months of 2008 .
1,"Most recently , he founded Virent Energy Systems , Inc. , an 80 person catalytic biofuels company , where , as president and CEO , he led the company through multiple financings , defined the company 's market strategy , and secured the company 's first customers ."
0,"The staff reduction will start immediately , Glaston added ."
1,"The bond , with a maturity of five years , is part of the bank 's domestic bond program ."
0,Earnings per share ( EPS ) in 2005 decreased to EUR1 .87 from EUR1 .89 in 2003 .
1,"The business idea of Budget Sport is to offer customers a wide range of high-quality sports equipment and clothing at low prices , the company said ."
1,No more waste-burning facilities should be built .
1,"Finnish investor Scanfil Oyj ( HEL : SCF1V ) said last Friday it has bought 57 million shares , or 32.96 % , in Norwegian contract electronics manufacturer Kitron ASA ( OSL : KIT ) for NOK 143.9 million ( USD 24.4 m-EUR 18.1 m ) ."
2,"The subscriptions increase Cargotec 's share capital by 36,780 euros ."
2,Finnish handling systems company Cargotec Oyj ( HEL : CGCBV ) said today that it won a EUR 13 million ( USD 16.6 m ) contract to deliver MacGregor hatch covers for ships ordered by Norwegian shipowner Grieg Shipping .
1,"The equipment Ixonos acquires with this deal includes mechanical engineering hardware ; an RF and antenna measurement laboratory ; facilities for the measurement of audio , cameras and displays ; as well as devices and robot units for the testing of mobile devices ."
0,"The decision means temporary lay-offs of fixed duration at the company 's Nastola and Jyvaskyla units , in southern and central Finland , respectively ."
1,Kaupthing Bank will publish its annual results for 2007 before markets open on Thursday 31 January .
2,"The services also give the supplier opportunity to key-in invoices , receive orders electronically , to send order confirmations and to upload and create electronic catalogues ."
2,"Jobs will not be transferred from Finland , however ."
2,"( Filippova ) A trilateral agreement on investment in the construction of a technology park in St Petersburg was to have been signed in the course of the forum , Days of the Russian Economy , that opened in Helsinki today ."
1,"ALEXANDRIA , Va. , Dec. 22 -- United States Patent no. 7,854,608 , issued on Dec. 21 , was assigned to Outotec Oyj ( Espoo , Finland ) ."
1,"HKScan is one of the leading food companies in northern Europe with homemarkets in Finland , Sweden , the Baltic countries and Poland ."
1,Salcomp Manufacturing Oy will pay EUR 35 million in cash to Salcomp in connection with the implementation of the sale and transfer of the Business .
2,"For Teleste , the acquisition marks an entry into services business in a market where it has long been an established and significant supplier of products ."
2,With this appointment Kaupthing Bank aims to further co-ordinate Capital Markets activities within the Group and to improve the overall service to clients .
2,"` Ruukki has experience of logistics construction , competence in project management and also has the best references in terms of steel frame production and installation , ' says Onodi Stefan , General Manager of Arxikon Construction Company SRL , which is Ruukki 's customer ."
1,"HELSINKI AFX - Salcomp , the mobile phone charger manufacturer , said it has appointed Markku Hangasjarvi as its new CEO , following the resignation of Mats Eriksson ."
1,The following information was released by Comptel : Tomorrow the Chairman of the Federal Communications Commission is scheduled to deliver the National Broadband Plan to Congress .
1,Finnlines has six ships under construction in China with deliveries scheduled between the first quarter of 2011 and the final quarter of 2012 .
1,"On 25 August 2009 , Sampo 's stake in Nordea was 19.45 % ."
1,"At 10.58 am , Outokumpu declined 2.74 pct to 24.87 eur , while the OMX Helsinki 25 was 0.55 pct higher at 2,825.14 and the OMX Helsinki added 0.64 pct to 9,386.89 ."
2,The price for logs has clearly improved from 2009 and also the price of pulpwood has gone up .
0,"However , the growth margin slowed down due to the financial crisis ."
1,"Takoma will carry out the transaction by acquiring the entire share capital of Moventas Parkano Oy , which runs the factory in Parkano , southern Finland ."
1,"LLC , a voice and data management solution provider to wireless companies with operations worldwide , will be transferring its U.S. deployment operations to the Finnish mobile giant , which includes civil works and site acquisition services ."
2,"Finnish Sampo Bank , of Danish Danske Bank group , reports profit before taxes of EUR 152.3 mn in 2010 , up from EUR 32.7 mn in 2009 ."
2,Operating profit rose to EUR 4.7 mn from EUR 4.6 mn .
1,Panostaja Oyj 's Board also decided at its organisational meeting held upon completion of the AGM to implement the AGM decision concerning Board member fees paid as shares in such a way that shares are transferred on a quarterly basis on the date following publication of the quarterly-annual report .
1,In 2007 Etteplan reported a turnover of EUR125 .2 m.
1,"The second company acquired is Sweden 's Reftele Maskinservice AB , whose business is mainly field services and spare parts manufacturing , with 10 employees and 1.2 mln eur sales a year ."
2,"Dubai Nokia has announced the launch of `` Comes with Music '' , its ground-breaking service which introduces a new way for people to enjoy music ."
1,The retail chain launched in 2007 does not correspond to profit and sales forecasts of the company .
1,It is expected to be online by 2011 .
1,"Weber convinced his friend Ray Ostrom , who owned a Lake Street sporting goods store , to sell the lures ."
1,"The port operator , however , favors retaining the port fees in 2010 , citing the owner , the governemtn of Estonia , commiting the port to pay EEK 400mn ( EUR 25.56 mn USD 36.44 mn ) in dividends to the state in 2009 and another EEK 300mn in 2010 ."
1,The contracts comprise turnkey orders for RoRo systems for two RoRo-cruise vessels under construction for Viking Line and Tallink .
1,The order was valued at USD12 .2 m.
1,Name of Company in which holdings have been acquired : Citycon Oyj 2 .
2,One attractive factor about the tablets for media companies is that they provide a new way of making money .
2,"We also strengthen our existing partnership with Cybercom '' , says Teleste CTO Esko Myllyla ."
2,Panostaja Oyj s ( Panostaja ) Board of Directors decided on 16 December 2010 on a new long-term incentive and commitment plan for members of the management team .
1,Vaisala 's expertise in lightning data and information systems is based on extensive experience and investment in R&D .
1,"LONDON ICIS -- Tikkurila has completed the sale of its powder coatings business to Finnish industrial coatings firm Teknos Group , the Finland-based decorative paints company said on Wednesday ."
1,"Tulikivi manufactures heat-retaining , soapstone and ceramic fireplaces , as well as natural stone products and utility ceramics ."
2,Incap and Lankapaja aim to enter into actual agreement to transfer the sheet-metal production to the buyer in February in order to complete the transfer on 1 March 2011 .
1,"Swedish telco TeliaSonera is teaming up with Friends , a Swedish organization against bullying , to fight bullying of children and teenagers via electronic channels ."
2,"Consumer products manufacturer Fiskars Corp. will open a distribution and warehouse center in Southaven , creating 100 jobs ."
2,Componenta 's objective with this agreement is to increase business on its existing production lines .
2,Sports equipment sales also progressed well owing to the prolonged winter season .
1,"`` Tweeple should check who 's following them , and be cautious when clicking on URLs and tinyurls . ''"
1,"The scope of the project is to find the most cost-efficient method for phosphorous removal and to deliver the storing and dosing equipment , which can be used in continuous operation at the plants ."
1,"Tikkurila , a division of Kemira group , controls about 23 % of the Russian market in its field and owns St. Petersburg paint producer TEX. ."
1,Stock Exchange Release 10/3/2011 12:00 Sanoma has published its Annual Report and Financial Statements for 2010 and its first Corporate Responsibility Report .
0,"Most of the permanent layoffs will be in the plywood and sawn timber sectors of the Finnish company 's operations at several domestic mills , where earlier this year it temporarily laid off some 1,200 workers to save costs ."
1,"It is necessary to strengthen the company 's operations , however ."
1,OP-Pohjola Group 's capital adequacy ratio under the Act on Credit Institutions stood at 12.1 % and Tier 1 ratio at 12.1 % .
1,Tekla Group 's net sales for 2005 were approximately 38 million euros .
1,No financial details were disclosed .
1,"Glaston 's own glass processing unit , Tamglass Glass Processing , is a manufacturer of high quality safety glass products operating in Finland ."
1,"As an alternative to the share exchange , Panostaja offers a full cash consideration at the value of 1.27 euro $ 1.7 per share ."
1,"These sections will be put into place to form the load-bearing steel structure of the bridge , '' says Sami Eronen , Senior Vice President , Infrastructure and Northern Europe , Ruukki Construction ."
1,"Thus the group 's balance sheet will have about EUR25 .8 m of goodwill , the company added ."
2,"Finnish IT solutions provider Affecto Oyj said today that it has won a frame contract , valued at some EUR2m , to implement the next phase of its insurance application for South African Mutual & Federal Insurance Company Limited M&F ."
1,"The equipment is designated to Bollore Africa Logistics terminal Societe d'Exploitation du Terminal de Vridi SETV in Abidjan , Ivory Coast and the delivery is scheduled to start in March 2010 ."
1,The company operates power plants in the Tyumen and Chelyabinsk regions and in the Khanty-Mansi Autonomous District .
1,The company said shareholders will be able to vote on the agreement at an EGM scheduled for later this month .
1,The forecast for 2012 is 3.3 % .
0,"We have also cut our price projections for paper and packaging , '' an analyst with Goldman Sachs said on a note on Monday ."
2,"`` Our customers now have the chance to make bookings for all the services they want at one location , '' said Mikko Tuomainen , in-charge of Finnair 's Internet ( sales ) ."
1,"Lember said the matter was topical also in Estonia , where a bill has been drafted at the Social Affairs Ministry that would scrap old-age pensions on favorable conditions ."
1,The company plans to increase the unit 's specialist staff to several dozen -- depending on the market situation during 2010 .
0,The company said that its comparable operating profit for the January-June period fell short of last year 's corresponding performance .
1,Veracel is preparing an appeal in the issue and has asked the court for clarification of the judgement .
1,"Deutsche Beteiligungs , as well as a private equity fund it manages , first bought 75 % of MCE in a secondary buyout from White Plains , N.Y. , financial investor Andlinger & Co. in 2007 ."
1,"Metso is a global supplier of sustainable technology and services for mining , construction , power generation , automation , recycling and the pulp and paper industries ."
2,Circulation revenue has increased by 5 % in Finland and 4 % in Sweden in 2008 .
0,"Compared with the FTSE 100 index , which rose 36.7 points ( or 0.6 % ) on the day , this was a relative price change of -0.2 % ."
1,Work on the assignment has already started and is due for completion in spring 2011 .
1,"Aspocomp said it will spin off its Chinese and Indian units , and some equipment from its Salo plant in Finland , into a newly-formed unit , most of which it will then sell on to Hong Kong-listed Meadville ."
1,Juha-Pekka Weckstr+¦m has been appointed President of telecom group TeliaSonera Finland to succeed Esa Rautalinko .
1,The divested activities had net sales of EUR 145.1 million in 2009 and an operating profit of EUR 8.9 million .
0,Operating profit in the fourth quarter fell to EUR33m from EUR39m a year earlier .
1,"Some 3.8 mln euro ( $ 5.2 mln ) of the base acquisition price will be paid in cash and the rest through a subscription offering of a total of 850,000 new Ixonos shares ."
0,"Net sales of Kyro 's main business area , Glaston Technologies , a manufacturer of glass processing machines , decreased to EUR 161.5 mn from EUR 164.1 mn in January-September 2005 ."
2,Sales of clothing developed best .
1,"SAN FRANCISCO ( MarketWatch ) -- Nokia Corp , the world 's largest cell-phone maker , is using the Consumer Electronics Show in Las Vegas to introduce a high-end , thin folding phone , according to a media report Monday ."
1,The contract involves refurbishing the bathrooms of 189 units as well as re-plumbing their water and sewer pipes .
1,The fine print is here .
1,"Panostaja Plc today acquired the entire share capital of Suomen Graafiset Palvelut Ltd , a provider of printing services ."
0,The move was triggered by weak demand for forestry equipment and the uncertain market situation .
1,( The acquisition sum has not been disclosed . )
1,"Finnish AC drives manufacturer Vacon is acquiring the AC drives business of TB Wood 's , part of the US group Altra Holdings ."
0,"Many of the commercial vessels had got stuck in the narrow Bay of Bothnia , where the ice is thicker , and around the Aaland islands ."
1,The new chain has 700 discount stores and 250 supermarkets .
2,"In 2006 , the company intends to invest significantly in expanding its distribution and maintenance network ."
1,The company admits that 36 months is a relatively short time when operating in Russia .
1,"According to preliminary information by the Finnish Forest Industries Federation , imports of roundwood to Finland increased to about 20 million m3 in 2005 , representing an increase of 15 % from 2004 ."
0,Sales by Seppala diminished by 6 per cent .
1,"The business area has operations in Finland , Sweden , Denmark , Estonia , Latvia and Lithuania ."
1,"The add-on order contains , among others , control valves and instrumentation as well as complete mill engineering and electrification with Metso drive controls ."
2,"For the current year , Raute expects its net sales to increase and the operating result -- to be positive ."
1,The insurance division turned a EUR120m profit .
1,Finnish Nordic Aluminium is starting employer-employee negotiations in Finland that concern all staff groups .
2,Finland 's Poyry Energy has won a contract to advise builders of a new cogeneration power plant in Lithuania 's second-biggest city of Kaunas and to supervise the construction process .
1,"The aim of the CEO 's Q&A sessions is to give further clarity on information , which has been made public already earlier ."
0,Finnish laboratory liquid handling and diagnostic test systems developer Biohit Oyj OMX Helsinki : BIOBV issued on Tuesday 3 June a profit warning for the financial year 2008 .
1,"As earlier reported , Nokian Tyres is building a plant in the town of Vsevolozhsk in Russia 's Leningrad Region with an annual production capacity of 4 million tires ."
1,"The corresponding increase in the share capital , EUR422 ,754 , has been entered in the Trade Register today ."
2,The investments and operational changes enable additional optimisation of the working hours and thereby further cost savings of some 7 % -9 % .
1,"shock phase ' , consumers have once again started to plan and implement building projects ."
1,"Stockholm-based Nordea Bank ( STO : NDA ) said yesterday it had hired Casper von Koskull to lead its corporate merchant banking and capital markets unit , effective 1 September ."
2,"Operating profit totalled EUR 83.0 mn , up from EUR 23.5 mn year-on-year ."
2,"At the end of the review period , Nordic Aluminium 's order book stood at EUR 8.77 mn compared to EUR 7.04 in 2005 ."
2,A new Kveyt light variety of Suomalainen Pekoni marketed under the Atria brand name is now available to consumers in Finland .
1,"Janno Reiljan , a member of the Eesti Energia supervisory board , said the owners of Narva Power Grid had informed Eesti Energia about their wish to sell ."
0,"The negotiation has resulted in the reduction of 80 people in regular employment , around half of which will be covered with pension arrangements ."
1,The company has an annual turnover of EUR32 .8 m.
1,"---------------------------------------------------------------------- -------------- Munich , 14 January 2008 : BAVARIA Industriekapital AG closed the acquisition of Elcoteq Communications Technology GmbH in Offenburg , Germany , with the approval of the"
1,Elcoteq expects its net sales for the last quarter of 2010 to be on the level of the third quarter .
1,One of the largest projects of the magazine division of SanomaWSOY - Sanoma Magazines International in 2006 became launch of the Russian magazine Gloriya .
2,Last year 's net sales rose to EUR 68.3 million from EUR 62.2 million .
0,One of the challenges in the oil production in the North Sea is scale formation that can plug pipelines and halt production .
1,Completion of the transaction is subject to a final agreement and a Due Diligence process .
0,"Also the city 's insurance company , If P & C Insurance , has said it will not pay compensation ."
1,"Stora Enso Oyj said Friday it will sell its North American unit to NewPage , in a deal valued at euro1 .82 billion US$ 2.52 million ."
2,"Consolidated operating profit excluding one-off items was EUR 30.6 mn , up from EUR 29.6 mn a year earlier ."
1,"At some point , it will spread also to Iran and Iraq ."
0,"However , its market share shrank to 47.59 per cent from 48 per cent a year earlier ."
1,The reductions will be concluded by autumn 2010 .
2,Raute said it has won an order worth around 15 mln eur to supply several plywood production lines to mills operated by Russian wood products company Sveza Group .
0,As a result of these negotiations the company has decided to make 45 people redundant on financial and production grounds .
1,"Founded in 1649 , Fiskars has over 360 years of product quality excellence and is Finland 's oldest company ."
0,"The result will also be burdened by increased fixed costs associated with operations in China , and restructuring costs in Japan ."
1,We are now taking Marimekko there on a distinctly more significant scale .
1,"Operating profit of operations in Finland in the period under review totaled EUR 11.3 mn , remaining at the 2005 level ."
1,"Sponda is a property investment company , specialising in commercial properties in the largest cities in Finland and Russia ."
1,"With the second phase of the new Innova building , Tecnopolis presence in Jyvaskyla will increase to a total of approximately 62,000 floor square meters ."
0,Return on investment ROI was 4.1 % compared to 43.8 % in the first half of 2008 .
1,"CapMan , with offices in Helsinki , Stockholm , Copenhagen and Oslo , manages Nordic buyout , mezzanine , technology , life science and real estate funds with approximately EUR2 .6 bn in total capital ."
1,The presentation material can be viewed on the company 's website in English after the conference .
1,"The program , which was started in the summer of 2007 , was originally estimated to last approximately two years ."
0,ArcelorMittal Chief Executive Officer Lakshmi Mittal has already cut output at some furnaces .
2,"Comptel , a vendor of dynamic Operations Support System ( OSS ) software , has been selected by Orascom Telecom ( OTH ) as partner for provisioning and activation solutions for mobile services ."
1,"Aldata Solution Oyj Stock Exchange Release 11 August 2006 , at 11.00 am ALDATA SHARES SUBSCRIBED FOR WITH 2003 STOCK OPTIONS A total of 95,000 new shares of Aldata Solution Oyj have been subscribed for with the company 's 2003A stock options ."
1,Kauko-Telko 's centralized administration will be dissolved and appropriate parts of it will be transferred to operating activities and Group administration by the end of the year .
1,"Honkarakenne also decided yesterday to sell 88,500 of its B-series shares to key staff members for EUR 2.90 per share ."
2,The Department Store Division reported an increase in sales of 4 per cent .
1,"The figure includes the change in the fair value of the property portfolio , EUR 26.2 million ."
1,"The maximum amount of the capital loan will be EUR30m and the minimum subscription -- EUR10 ,000 ."
0,"The workforce will be reduced also in the Amsterdam office , in the Netherlands ."
0,"However , the company saw its net profit for the third quarter down to EUR1 .4 m from EUR1 .5 m for the corresponding period of 2009 ."
1,"Capacity of the facility made by Finland 's Vaahto Group is 86,000 tons of light coated paper ."
0,The current reference grade instruments are challenging to operate due to their high price and complexity for routine use .
1,- Tikkurila inspires you to color your life .
1,Registration is required .
1,It is hand-painted resin with real 14-0 trebles and is 75cm long by 25cm deep from top to bottom of the middle hook .
1,"Tekla 's defense business employs over 20 persons and is located in Espoo , Finland ."
1,`` I 'm not sure what 's happening .
2,"Finland 's Nokian Tyres and Kazakhstan 's Ordabasy Corporation signed an agreement to build a plant in Astana to produce car tires , Ordabasy chairman Dinmukhamet Idrisov said at a press conference ."
2,"Finnish investment group Panostaja Oyj said its net profit went up to 8.6 mln euro $ 11.4 mln in fiscal 2005-06 , ended October 31 , 2006 , from 2.8 mln euro $ 3.7 mln in the same period of fiscal 2004-05 ."
1,"Elite Residence Tower , a new development by Tameer , is located at the heart of Dubai Marina ."
1,"Nokia Siemens Networks provides mobile and fixed network infrastructure , communications and networks service platforms , as well as professional services , to operators and service providers ."
1,"According to Sweden 's Minister for Local Government and Financial Markets , Mats Odell , the decision to sell the State 's shares in telecom group TeliaSonera can only be carried out in cooperation with the State of Finland ."
0,Asian traffic declined by 3.4 per cent .
2,"Tallink claims the watertight doors of both Vana Tallinn and Regina Baltica , including their electrical systems , are fully in working order ."
2,- I am pleased that Bjorn Wahlroos has accepted the nomination .
1,Olli-Pekka Kallasvuo was elected as vice chairman of the Board .
1,"The shares subscribed for under the stock options were registered in the Trade Register on 20 January 2011 , as of which date the new shares will establish shareholder rights ."
1,The newspaper 's best sales asset is high quality journalism and journalistic content .
1,The deal was worth about EUR 1.2 mn .
1,"Ahlstrom Corporation STOCK EXCHANGE ANNOUNCEMENT 23.4.2007 Ahlstrom Corporation will publish its first quarter financial results 2007 on Friday , April 27 , 2007 approximately at 8.30 a.m. Finnish time ."
1,"CapMan has four investment areas ( CapMan Buyout , CapMan Technology , CapMan Life Science and CapMan Real Estate ) , and each of them has a dedicated team ."
1,"The corresponding increase in the share capital , in total EUR 300,00 was registered in the Finnish Trade Register on May 8 , 2008 ."
